name,description,long_description,date,importance,unemployment_rate,unemployment_rate_6m,unemployment_rate_12m,unemployment_rate_18m,unemployment_rate_24m,gdp,gdp_6m,gdp_12m,gdp_18m,gdp_24m,cpi,cpi_6m,cpi_12m,cpi_18m,cpi_24m,oil_price,oil_price_6m,oil_price_12m,oil_price_18m,oil_price_24m
Introduction of NAFTA,North American Free Trade Agreement came into effect,"Created to eliminate trade barriers between the United States, Canada, and Mexico, the North American Free Trade Agreement (NAFTA) came into effect on January 1, 1994. The agreement aimed to promote trade and economic growth among the three countries by reducing tariffs and fostering cross-border investment. While NAFTA led to increased trade and economic integration in North America, it also faced criticism for job losses in certain sectors due to outsourcing and impact on wages. The long-term economic effects significantly shaped North America's economy and labor market.",1994-01-01,4,6.6,6.1,5.6,5.6,5.6,10939.116,11087.361,11319.951,11353.721,11614.418,3.375759896,3.194738495,3.144200833,3.332283478,3.277075064,15.0,19.07,17.99,18.42,18.88
Introduction of the Internet,Mass adoption of the Internet affecting global economy,"The mass adoption of the Internet in the late 1990s transformed the global economy. Businesses began using the Internet for e-commerce, impacting traditional commerce, advertising, and consumer behavior. The rise of online marketplaces and the shift towards digital transactions led to significant changes in business models across various sectors. Economically, this surge contributed to the dot-com bubble in the late 1990s and influenced job creation in tech-related fields, while also prompting traditional businesses to adapt to digital changes, fundamentally reshaping global commerce.",1995-01-01,4,5.6,5.6,5.6,5.3,5.4,11319.951,11353.721,11614.418,11808.14,12037.775,3.144200833,3.332283478,3.277075064,3.051784638,3.05642197,17.99,18.42,18.88,20.45,25.39
Dot-com Bubble Burst,Collapse of the internet-based companies.,"The Dot-com Bubble Burst occurred in the early 2000s, indicating the collapse of the technology-driven stock market fuelled by excessive speculation. At its peak in March 2000, the NASDAQ composite was near 5,000, largely driven by internet companies. This bubble burst led to significant losses in stock prices, and many companies, including well-known firms, filed for bankruptcy. The burst had dire consequences, resulting in the loss of millions of jobs and a recession that severely impacted the technology sector, which took several years to recover. The effects also spilled over to other sectors, causing a broader economic downturn in the United States and impacting global markets.",2001-03-10,5,4.3,5.0,5.7,5.7,5.9,14183.12,14214.516,14372.785,14519.633,14614.141,2.961886,3.388746,3.46848,3.026606,2.619135,27.24,25.88,24.42,29.67,33.55
September 11 Attacks,Terrorist attacks in the United States.,"On September 11, 2001, a series of coordinated terrorist attacks by the extremist group Al-Qaeda targeted the United States. Nineteen terrorists hijacked four commercial airliners, crashing two into the Twin Towers of the World Trade Center in New York City and one into the Pentagon, while the fourth, United Airlines Flight 93, crashed in Pennsylvania after passengers attempted to regain control. The attacks led to the deaths of nearly 3,000 people and significant destruction. Economically, the attacks caused immediate panic, the closure of financial markets, and a loss of consumer and business confidence. The United States experienced a recession following the attacks, and the airline industry faced severe downturns, leading to massive layoffs and bankruptcies. The costs of increased security measures and military responses further strained the economy.",2001-09-11,5,5.0,5.7,5.7,5.9,6.1,14214.516,14372.785,14519.633,14614.141,14988.782,3.388746,3.46848,3.026606,2.619135,2.174311,25.88,24.42,29.67,33.55,28.29
Enron Scandal,Corporate fraud and bankruptcy of Enron Corporation.,"The Enron scandal erupted in late 2001 when it was revealed that Enron Corporation, one of the largest energy companies in the world, had been engaged in widespread accounting fraud. The company had been inflating its profits and hiding debt through complex financial structures. When the truth came to light, Enron filed for bankruptcy in December 2001, costing thousands of jobs and billions in investments. This scandal triggered one of the biggest collapses in corporate history and led to increased regulatory scrutiny in the financial markets. It shed light on the deficiencies in corporate governance and accounting practices, ultimately leading to the Sarbanes-Oxley Act in 2002, aimed at enhancing corporate accountability. The scandal severely impacted investor confidence in the stock market and affected the economy.",2001-12-02,4,5.7,5.8,6.0,6.1,5.7,14253.574,14460.848,14537.58,14743.567,15162.76,3.564921,3.452132,2.792164,2.338588,1.967767,19.33,27.02,29.42,28.14,32.15
Global Financial Crisis (2007-2008),Severe worldwide economic crisis.,"The Global Financial Crisis, which began in 2007 and reached its peak in 2008, was a severe worldwide economic crisis that started with the collapse of the housing bubble in the United States. High-risk mortgage lending practices, particularly subprime loans, led to a spike in home foreclosures. Financial institutions accumulated massive losses on mortgage-backed securities, leading to a liquidity crisis. Major financial institutions such as Lehman Brothers declared bankruptcy in September 2008, marking a significant turning point. The crisis led to a severe recession, massive unemployment, and government bailouts of various financial institutions around the world. The global economy witnessed a significant contraction, and the effects of the crisis were felt for many years, with slow recovery across many economies.",2008-09-15,5,6.1,8.7,9.8,9.9,9.5,16854.295,16298.262,16326.281,16582.71,16872.266,3.071629,2.437701,1.602846,0.9255024,0.6638685,103.9,47.98,69.46,81.24,75.31
Icelandic Financial Crisis,Collapse of Iceland's banking system.,"In 2008, Iceland's banking system collapsed, leading to a severe national financial crisis. The country's three major banks – Kaupthing, Landsbanki, and Glitnir – were over-leveraged, and as the global credit market tightened during the financial crisis, they became unable to refinance their debts. The government was forced to take control and ultimately nationalized the banks. The crisis led to severe economic contraction, as Iceland's economy plunged into a recession, unemployment surged, and the currency lost significant value. The impact on the economy was profound, requiring financial aid from the International Monetary Fund (IMF) and subsequently leading to extensive reforms and restructuring within the banking sector.",2008-10-06,4,6.5,9.0,10.0,9.9,9.4,16485.35,16269.145,16502.754,16743.162,16960.864,2.922213,2.359914,1.509202,0.869413,0.6723344,76.65,49.79,75.82,84.48,81.9
European Debt Crisis,A multi-year debt crisis affecting eurozone countries.,"The European Debt Crisis, which began in 2009, was a multi-year financial crisis that affected countries in the eurozone, particularly Greece, Ireland, Portugal, Spain, and Italy. It was triggered by high sovereign debt levels and a failure to manage fiscal policies effectively. Greece was the first country to face a severe crisis, resulting in the country needing bailouts from the EU and International Monetary Fund (IMF) to avoid default. The crisis led to massive austerity measures, social unrest, and a significant contraction in GDP for the affected countries. The European Central Bank took measures to stabilize the economy, which included lowering interest rates and purchasing government bonds. The crisis had long-lasting impacts on the European economy and led to greater scrutiny of fiscal policies within the eurozone.",2009-05-01,5,9.4,10.0,9.6,9.4,9.0,16269.145,16502.754,16743.162,16960.864,17035.114,2.273815,1.509202,0.793302,0.6723344,1.256079,59.16,75.82,73.84,81.9,101.33
China's Economic Rise,China's rapid economic growth in the early 2000s.,"Between 2000 and 2010, China experienced unprecedented economic growth, emerging as a global economic powerhouse. China's entry into the World Trade Organization (WTO) in 2001 catalyzed this growth, as it opened up its markets to international trade and investment. The manufacturing sector saw a massive boom, leading to a surge in exports. China's economic policies led to a migration of labor from rural areas to urban centers, fueling industrialization. The economic impact was significant, with China becoming the world's second-largest economy by 2010, influencing global trade dynamics, commodities markets, and even resulting in shifts in geopolitical power due to its economic leverage.",2010-01-01,4,9.8,9.4,9.1,9.1,8.3,16582.71,16743.162,16920.632,17035.114,17367.01,1.170764,0.7780127,0.9539952,1.29395,2.113351,78.22,75.35,89.42,96.29,100.24
Gulf Oil Spill (Deepwater Horizon),Massive oil spill caused by offshore drilling accident.,"In April 2010, the Deepwater Horizon oil rig, operated by BP, experienced a catastrophic blowout while drilling in the Gulf of Mexico, resulting in one of the largest environmental disasters in U.S. history. An estimated 4.9 million barrels of crude oil spilled into the Gulf over a period of 87 days, leading to unprecedented environmental damage and economic fallout for the coastal communities and industries reliant on the fishing and tourism sectors. The heavy costs of clean-up operations and legal liabilities for BP significantly impacted their stock prices and led to broader discussions on energy policy and offshore drilling regulations. The spill highlighted the vulnerabilities of the energy sector and had long-lasting repercussions for the local and national economy.",2010-04-20,5,9.9,9.4,9.1,8.8,8.2,16743.162,16960.864,17035.114,17222.583,17444.525,0.869413,0.6723344,1.210295,1.835844,2.191796,84.48,81.9,110.04,86.41,103.33
Haitian Earthquake,Devastating earthquake in Haiti.,"On January 12, 2010, a powerful earthquake struck Haiti, registering a magnitude of 7.0. The epicenter was near the densely populated capital, Port-au-Prince, devastating the infrastructure and displacing millions. An estimated 230,000 people lost their lives, and many more were injured. The economic impact was catastrophic; the nation's infrastructure was crippled, and the estimated damage was around $8 billion, which was about 120% of Haiti's GDP. The international community responded with significant humanitarian aid, but the recovery took years, revealing existing vulnerabilities within the Haitian economy and governance.",2010-01-12,5,9.8,9.4,9.1,9.0,8.3,16582.71,16872.266,16920.632,17031.313,17367.01,1.170764,0.7440706,0.9539952,1.41844,2.113351,78.22,76.37,89.42,97.19,100.24
Eurozone Debt Crisis,Economic turmoil in the Eurozone region due to high public debt levels.,"Beginning in 2010, several countries in the Eurozone, particularly Greece, faced rising government debt and deficits. This led to fears of default and the potential for financial contagion across Europe. Countries like Portugal, Ireland, Italy, Greece, and Spain struggled with their debts, prompting intervention from the European Central Bank and the International Monetary Fund. The Eurozone Debt Crisis led to austerity measures in affected countries, resulting in widespread public unrest and economic decline. The crisis had significant global repercussions, leading to weakened investor confidence and a slowdown in economic recovery worldwide.",2010-01-01,5,9.8,9.4,9.1,9.1,8.3,16582.71,16743.162,16920.632,17035.114,17367.01,1.170764,0.7780127,0.9539952,1.29395,2.113351,78.22,75.35,89.42,96.29,100.24
Arab Spring,A series of anti-government protests and uprisings across the Arab world.,"The Arab Spring began in late 2010 with protests in Tunisia against rising unemployment and corruption. The movement quickly spread to countries like Egypt, Libya, Yemen, and Syria. As authoritarian regimes were challenged, several governments were either overthrown or faced significant upheaval. The unrest led to economic instability in the region, affecting oil prices and foreign investment. Countries experiencing conflict, like Libya and Syria, faced severe declines in their economies, causing ripple effects on global markets due to their strategic locations and resources.",2010-12-01,4,9.3,9.0,8.5,8.2,7.7,16960.864,17035.114,17222.583,17444.525,17489.852,0.8307821,1.256079,2.045078,2.188203,2.195661,89.04,101.33,98.57,94.7,86.66
Fukushima Nuclear Disaster,A catastrophic nuclear accident following a tsunami in Japan.,"In March 2011, a massive earthquake and subsequent tsunami struck Japan, causing a meltdown at the Fukushima Daiichi Nuclear Power Plant. The disaster resulted in radioactive leaks, forcing thousands to evacuate and leading to long-term health concerns. The environmental impact was profound, affecting Japan's agriculture and fishing industries, which suffered substantial losses. The disaster prompted a re-evaluation of nuclear energy policies worldwide, leading many countries to halt or reduce their nuclear programs, which in turn influenced global energy markets and investment flows.",2011-03-11,5,9.0,9.0,8.2,7.8,7.5,16920.632,17031.313,17367.01,17469.65,17662.4,1.179972,1.721515,2.122799,2.219253,2.096923,102.94,85.61,106.19,94.72,93.05
Chinese Stock Market Crash,A major stock market crash in China affecting global markets.,"In mid-2015, China's stock market experienced a dramatic collapse, losing around 30% of its value within weeks. This crash was triggered by speculative trading and regulatory missteps. The decline heavily impacted global markets, as China is a significant driver of the world economy. Falling Chinese stock prices led to fears of slowing economic growth, affecting commodity prices, foreign investments, and trade partnerships. Countries heavily reliant on exports to China faced economic uncertainties, highlighting the interconnectedness of the global economy.",2015-06-01,4,5.3,5.1,4.8,4.7,4.4,18782.243,18892.206,19062.709,19304.352,19506.949,2.103732,2.394625,2.565678,2.518564,2.139634,59.82,42.44,46.71,45.66,48.48
U.S.-China Trade War,An ongoing economic conflict between the United States and China.,"Starting in 2018, the U.S. initiated tariffs on Chinese imports to address trade imbalances and intellectual property theft concerns. China retaliated with tariffs of its own, escalating a trade war that affected businesses globally. The uncertainty created by the trade war slowed economic growth in both countries and disrupted global supply chains. Companies faced increased costs, leading to higher consumer prices, reduced profits, and changes in international trade dynamics. The conflict has prompted businesses to rethink their manufacturing and sourcing strategies, affecting economic relationships between the two largest economies.",2018-07-01,5,3.8,3.9,3.7,3.6,11.0,20276.154,20304.874,20843.322,20985.448,19056.617,2.518753,2.456173,2.475923,2.752609,1.993544,70.98,49.52,57.35,59.88,38.31
COVID-19 Pandemic,A global pandemic that led to widespread economic disruption.,"The COVID-19 pandemic emerged in late 2019 and rapidly spread worldwide in 2020, causing unprecedented health and economic crises. Governments implemented lockdowns to control the virus's spread, leading to a massive decline in economic activity. Industries such as travel, hospitality, and retail were severely impacted, resulting in millions of job losses and business closures. Governments introduced stimulus measures to mitigate the economic fallout. The pandemic highlighted vulnerabilities in global supply chains and accelerated trends like remote work and e-commerce, reshaping how economies function and recover.",2020-01-01,5,3.6,11.0,6.7,5.9,3.9,20693.238,19056.617,20771.691,21389.005,21960.388,2.790484,1.993544,1.600671,2.558145,3.456458,57.52,38.31,47.02,71.38,71.71
Brexit Referendum,"The United Kingdom voted to leave the European Union, impacting global markets.","In June 2016, the UK held a referendum in which 51.9% of voters chose to leave the European Union. The immediate aftermath saw a dramatic fall in the value of the British pound, creating uncertainty in financial markets. The ongoing negotiations over the terms of the UK's exit led to prolonged periods of economic instability and volatility. These conditions affected investments, trade agreements, and economic growth forecasts both within the UK and the EU. The Brexit process highlighted challenges related to trade, immigration, and political dynamics, ultimately reshaping the economic landscape in Europe.",2016-06-23,4,4.9,4.7,4.3,4.1,4.0,19062.709,19304.352,19506.949,19882.352,20150.476,2.563629,2.585286,2.122109,2.117186,2.551897,48.76,51.97,45.18,57.88,67.87
Expansion of the African Continental Free Trade Area (AfCFTA),A landmark agreement aimed at reducing tariffs and promoting intra-African trade.,"In March 2018, 44 African nations signed the AfCFTA agreement aimed at creating a single continental market for goods and services across Africa. This historic pact aimed to enhance intra-African trade, which has long been hindered by tariffs and trade barriers. The agreement was expected to raise the continent's economic growth, stimulate job creation, and improve trade flows between African nations. As countries began to implement the agreement, it sparked discussions about regional economic integration and development, with the potential for long-term economic benefits for member nations.",2018-03-21,4,4.0,3.7,3.8,3.5,4.4,20044.077,20276.154,20431.641,20843.322,20693.238,2.366925,2.462881,2.356946,2.622934,2.606553,62.73,70.23,58.15,56.95,29.21
U.S. Economic Expansion,An extended period of economic growth in the United States following the Great Recession.,"In the decade following the 2008 financial crisis, the U.S. economy experienced a prolonged expansion, marked by decreasing unemployment rates, rising stock markets, and growth in various sectors such as technology and manufacturing. This expansion was characterized by policy measures including low-interest rates and quantitative easing by the Federal Reserve. The growing economy supported global markets, as the U.S. remained an essential trade partner for many countries. However, the expansion also led to debates about income inequality, wage stagnation, and the sustainability of growth trends, setting the stage for tensions faced later during the pandemic.",2010-01-01,5,9.8,9.4,9.1,9.1,8.3,16582.71,16743.162,16920.632,17035.114,17367.01,1.170764,0.7780127,0.9539952,1.29395,2.113351,78.22,75.35,89.42,96.29,100.24
California Wildfires,"A series of destructive wildfires affecting California, linked to climate change.","Throughout the 2010s, California experienced increasingly severe wildfires fueled by prolonged drought and climate change. The fires destroyed homes, forced evacuations, and disrupted local economies, particularly in sectors like tourism and agriculture. The 2018 Camp Fire in Paradise was one of the deadliest, leading to significant property damage and loss of life. The economic impact included rising insurance costs, increased demand for rebuilding efforts, and broader discussions about climate resilience and sustainability. These events prompted local and state governments to invest more in fire prevention and management strategies, reshaping fiscal priorities.",2018-01-01,4,4.0,4.0,4.0,3.6,3.6,20044.077,20150.476,20431.641,20602.275,20693.238,2.157823,2.551897,2.375054,2.392597,2.790484,63.7,67.87,51.38,54.66,57.52
COVID-19 Pandemic Declared,Global pandemic announcement,"In March 2020, the World Health Organization declared COVID-19 a global pandemic. The virus rapidly spread across the globe, leading to widespread health crises, lockdowns, and significant changes in daily life. Economically, the pandemic caused unprecedented disruptions. Governments imposed travel restrictions and social distancing measures that resulted in the closure of non-essential businesses. Global supply chains were disrupted, leading to shortages of goods and spikes in prices. Many industries, especially travel, hospitality, and retail, faced severe declines in revenue, leading to massive layoffs and furloughs. The global economy, which had seen consistent growth, entered a recession as GDP contracted in many nations, and governments implemented stimulus packages to mitigate the economic fallout.",2020-03-11,5,4.4,7.8,6.1,4.7,3.6,20693.238,20548.793,21058.379,21571.421,21903.85,2.606553,1.980283,1.592366,2.610662,4.534344,29.21,39.63,62.33,71.65,108.5
U.S. Economic Stimulus Packages,Government response to economic crisis,"In response to the economic fallout from the COVID-19 pandemic, the U.S. government launched several economic stimulus packages beginning in March 2020. The Coronavirus Aid, Relief, and Economic Security (CARES) Act provided direct payments to individuals, expanded unemployment benefits, and provided loans to businesses to help them retain employees. The total cost of the first round of stimulus was approximately $2 trillion. These measures were designed to boost consumer spending and stabilize the economy amid unprecedented job losses and reduced incomes. The impact was significant in preventing a complete economic collapse, leading to a gradual recovery as businesses reopened, although challenges like inflation began to emerge later as demand surged.",2020-03-27,4,4.4,7.8,6.1,4.7,3.6,20693.238,20548.793,21058.379,21571.421,21903.85,2.606553,1.980283,1.592366,2.610662,4.534344,29.21,39.63,62.33,71.65,108.5
Global Supply Chain Crisis,Post-pandemic supply chain disruptions,"Starting in 2020 and continuing into 2021 and beyond, the global economy experienced a supply chain crisis primarily due to COVID-19 related disruptions. As nations slowly reopened, demand for goods surged, but production and shipping struggled to keep pace. Factors such as port congestion, labor shortages, and delays caused substantial delays in the delivery of products. Prices for goods skyrocketed due to the imbalance of supply and demand. This crisis also highlighted vulnerabilities in global supply chains, prompting companies to rethink their logistics and sourcing strategies, leading to a shift towards more localized production in some cases. Major industries such as automotive and electronics were particularly affected, experiencing significant production halts.",2021-09-01,5,4.7,3.8,3.5,3.6,3.8,21571.421,21903.85,22066.784,22403.435,22780.933,2.610662,4.280304,6.348017,6.525,4.95977,71.65,91.64,84.26,76.83,89.43
Russia-Ukraine War,Geopolitical conflict and economic impact,"In February 2022, Russia launched a military invasion of Ukraine, leading to significant geopolitical tensions and economic ramifications worldwide. The conflict resulted in severe sanctions imposed on Russia by Western nations, which in turn led to spiraling energy prices as Europe, heavily dependent on Russian gas, sought alternative sources. The war further exacerbated global inflation rates, particularly in food and energy sectors, as Ukraine, a major exporter of grains, faced production disruptions. As a result, many countries grappled with rising costs of living and economic instability. The war heightened volatility in global markets and forced countries to reconsider their energy sources and trade partnerships.",2022-02-24,5,3.8,3.6,3.6,3.8,3.9,21903.85,22066.784,22403.435,22780.933,23053.545,4.280304,5.951312,6.525,5.172225,4.403102398,91.64,93.67,76.83,81.39,77.25
Inflation Surge in the U.S.,Rising prices affecting economies,"Beginning in mid-2021 and continuing into 2022, the U.S. experienced a significant surge in inflation rates, reaching levels not seen in decades. The Consumer Price Index rose sharply, driven by supply chain disruptions, increased demand as the economy recovered from the pandemic, and rising energy prices due to the geopolitical situation stemming from the Russia-Ukraine war. The Federal Reserve responded by gradually raising interest rates, aiming to rein in inflation. This situation had profound implications for households and businesses, with higher borrowing costs and reduced consumer spending impacting overall economic growth. Inflation became a central issue in economic discussions, affecting election outcomes and public sentiment.",2021-06-01,4,5.9,4.1,3.6,3.6,3.6,21389.005,21960.388,21919.222,22249.459,22539.418,2.558145,3.184384,5.39633,6.422543,5.586684,71.38,79.15,114.84,84.37,70.25
Global Food Crisis,Food shortages and rising prices,"In the wake of the COVID-19 pandemic and the ongoing conflict in Ukraine, a global food crisis emerged in 2022. Key agricultural regions faced production challenges due to adverse weather conditions, supply chain disruptions, and the war’s impact on grain exports from Ukraine. The Food and Agriculture Organization warned of rising food prices, which hit low-income countries hardest. Governments around the world scrambled to protect their food supply chains, with some implementing export bans, further driving up prices. This crisis intensified food insecurity for millions and sparked social unrest in various regions, highlighting the interlinked nature of global agriculture and economics.",2022-05-01,5,3.6,3.6,3.7,3.8,3.9,21919.222,22249.459,22539.418,22960.6,23223.906,4.950974,6.312946,5.975255,4.882928,4.412394524,109.55,87.55,71.58,85.64,85.35
